title,category
김남국  이재명   월에 당 대표 도전해야 ,Politics
김남국  송영길  서울시장 독배 마실 의지 보여 ,Politics
 김남국  송영길 서울시장 차출설에  주소 이전 포함 오늘 내 메시지 낼 수도  출발 ,Politics
김남국  송영길  독배 결연한 의지 이재명  당 대표 출마해야 ,Politics
김형기 경북대 명예교수  대구시장 공식 출마,Politics
경부 고속철 서대구역   일 개통 코레일 대구경북본부 고객 감사 행사,Politics
홍준표  대구시장 출마 공식 선언  체인지 대구  강조,Politics
 대구 영광 되찾겠다  홍준표  대구시장 출마 공식 선언,Politics
문 대통령  양산 사저   억에 매각,Politics
문 대통령  양산 매곡동 사저 매각으로   억 원 시세차익,Politics
  대통령   억 사저 사고파느라   억 빌렸다 갚아 재산공개 ,Politics
  대통령  매곡동 사저 매각     억원   억원 차익   억원       재산공개 ,Politics
김동연  국회와 성남에서 경기지사 출마 선언,Politics
 윤석열 정부  초기 운명   월  경기도지사  선거에 달렸다  고성호 기자의 다이내믹 여의도 ,Politics
정성호  유승민 경기도와는 일면식 없는 인물 ,Politics
김동연  경기도는 대한민국 압축판  내일 출마 선언 종합 ,Politics
   특활비 역대 정부 중 가장 적어  감사제도도 첫 도입 ,Politics
    특활비 김정숙 여사 옷값  무분별한 의혹제기 유감 ,Politics
김건희  대통령 취임식서 공식 인사 퍼스트레이디 행보 시작,Politics
박주선  전장연 대표는 대통령 취임식 초청 고려 대상   박근혜 전 대통령  최고 예우로 초청 ,Politics
인수위  대우조선해양 알박기 인사  비상식 몰염치  비판,Politics
대우조선 인사 논란 인수위  몰염치  vs    눈독 들이지 마라 ,Politics
공직자 재산 평균   억      억  천 신고,Politics
고위공직자 재산 평균   억       억 천만 원,Politics
안철수  총리 안 맡겠다   초대 총리에 한덕수 유력,Politics
총리 인선 작업 속도 이르면 주말 발표,Politics
 단독   당선인 측  집무실 이전 예산안 새로 짠다,Politics
국방부  용산 청사 이전  단계적 계획 수립 중 ,Politics
윤 당선인 측  일본의 역사왜곡 단호 대처  민주당 공세는 유감 ,Politics
 측    교과서 왜곡  개별 외교 사안   민주  역사 전쟁 항복 선언 ,Politics
   년 전  꿈 키운 곳  김동연  성남서 경기도지사 출마 선언,Politics
    에   만표 뒤진 경기도 유승민 김동연 뛰어들었다,Politics
 측   회동 후속 접촉 곧 이뤄질 것  총리 인선도 속도,Politics
  당선인 측  청와대와 집무실 이전 후속 조치 위한 접촉 있을 것 ,Politics
민주       여성 입당 토론회  기대 부응하도록 당 변화 ,Politics
박지현  우리      여성  물러설 곳 없다는 심정으로 민주당 지지 ,Politics
  NSC 상임위 개최  우크라이나 참전자 귀국 종용 ,Politics
NSC 상임위  우크라이나 참전자 지속 귀국 종용 ,Politics
 속보    당선인 측  다주택자 양도소득세 중과   월부터  년간 배제 ,Politics
 속보  인수위  다주택자 양도세 중과 유예부터 손본다   월부터  년간 배제 추진 ,Politics
 외안구단     두려울 게 없다  중 러  같은 듯 다른 뒷배,Politics
 외안구단   괴물 ICBM  발사는 진짜일까 본색 드러낸    다음은 ,Politics
 외안구단  중국이   당선인에 후순위  유례없이 주목 받는  전화 한 통 ,Politics
 외안구단  외교안보 부처 개편은  통상 기능 두고 외교부 산업부  기싸움 ,Politics
 월 가계대출 금리평균 연   육박 주담대도  년만 최고치,Economic
 이젠     대출금리 얼마나 더 오르나 따져보니 ,Economic
 월 은행 주담대 금리        년   개월 만에 최고,Economic
 우대금리  재개에도 가계대출 금리      까지 올라가,Economic
 새 정부도 밀어준다  정유 화학기업  미래동력은  수소 ,Economic
주총 맞은 에너지기업  새 정부도 힘실어준다 미래사업으로  수소  낙점 ,Economic
현대로템  국내 첫 바이오가스 활용 수소생산설비 납품,Economic
현대로템  국내 첫 바이오가스 활용 수소생산설비 납품,Economic
오미크론에 서비스업 타격  월 생산 두달연속   회복 주춤  종합 ,Economic
 속보   월 산업생산       투자         소비는      증가,Economic
코로나   확산 여파 산업생산  개월 연속 하락,Economic
오미크론 영향  산업 생산 두달 째 감소    경기회복 주춤 ,Economic
서울시  HDC현산에  개월 영업정지,Economic
 학동 붕괴  현산  개월 영업정지 현산  가처분 신청,Economic
국토부  부적격 건설사업자 뿌리 뽑는다 현장 상시 단속,Economic
국토부  시공능력  건설업자 단속 나선다 최대  년 영업정지,Economic
광주 김치 기능성 표시 마치고 일본수출 본격화,Economic
 샘표  미국 유럽에  캔 김치   종 출시 기업 ,Economic
포스코홀딩스  CCUS 수소환원제철 진행 상황 점검,Economic
 리얼밸류 경영  포스코홀딩스  그룹ESG협의회 신설,Economic
알아서 척척  캄테크  강조한 한종희 삼성 TV 신제품 공개,Economic
TV영역 무한확장  즐기는 TV 시대로 ,Economic
박정호 SK하이닉스 부회장  ARM  컨소시엄 형태로 인수 검토 중 ,Economic
SK하이닉스  곽노정 사장 각자 대표로 선임   박정호와 투톱,Economic
롯데손보  중간배당 자사주 매입 추진    주주가치 제고 본격화 ,Economic
롯데손보  중간배당이나 자사주 매입 추진 주주가치 제고 ,Economic
LG전자 스마트파크  제조 공정도 글로벌 최고 ,Economic
LG스마트파크  세계경제포럼  등대공장  선정,Economic
중소벤처기업진흥공단  지난해 중소벤처기업  만    명 일자리 창출 ,Economic
중진공  지난해  만    명 중소기업 일자리 창출 지원 ,Economic
 한은 빼곤 아무 것도 말할 수 없다    년 만에 떠나는 이주열  조지원의 BOK리포트 ,Economic
     장신 이창용은 한국의 폴 볼커가 될까  조지원의 BOK리포트 ,Economic
금리 인상에 거침없는 연준 한은은 왜 속도를 낼 수 없나  조지원의 BOK리포트 ,Economic
비둘기가 이끄는 매파 금통위  주상영 위원에 쏠리는 눈  조지원의 BOK리포트 ,Economic
오미크론 여전히   만명대    코로나  언제 독감처럼 되나,Social
정부  확진자 대면진료 활성화되면 재택치료 체계 전환 검토 ,Social
확진자도 동네 병원 한의원 대면진료 시작 일상회복 시동 거나,Social
동네 병원 대면진료 시작  부담 돼  초반 참여 저조,Social
 뇌물수수  유재수 전 부산시 경제부시장 유죄 확정,Social
 뇌물수수  유재수  부산시 경제부시장 유죄 확정,Social
대법   뇌물수수 혐의  유재수   부시장 징역 년 집행유예 년 확정,Social
대법원   뇌물 수수  유재수 전 부산 부시장 유죄 확정,Social
 부하 성폭행  무죄 논란 해군 장교들  대법원 판결 엇갈려,Social
 판결이 또 한 번 죽였다    해군 성폭행 피해자  엇갈린 판결에 절망,Social
부하 여군 성폭행 함장 사건  다시 재판  또다른 장교엔  무죄 ,Social
대법    부하 성폭행  해군 장교 무죄판결 파기   재판 다시하라 ,Social
안산시 법인지방소득세 신고 납부  월  일까지 접수,Social
 코로나 피해 중소기업 법인지방소득세 납부기한 연장 경남소식 ,Social
태백시  법인 지방소득세 신고 납부 기한 직권 연장,Social
귀속 법인지방소득세 신고 태백 ,Social
인수위     명 자정 으로 거리 두기 완화 요청,Social
영업시간 제한 없어질까  드디어 풀리나  환영 속  확진자 폭증  우려도,Social
위중증     명 역대 최다 신규 확진   만여 명 감소,Social
누적     만명 돌파  신규확진   만   명    만명  상보 ,Social
취약 소상공인 경제방역 추진      억원 지원,Social
조현석 이사장  인천 소상공인에  월부터 무이자 경영자금    억 지원 ,Social
남편 보험금  억 노린  가평 계곡 살인  용의자  명 도주 공개수배,Social
 이 얼굴을 잘 보십시오   그알  가평계곡 익사사건 지명수배,Social
 법원서  손해  배 배상  판결 대법  우리도 허용해야 ,Social
미국 법원의   배 손해배상  명령   대법  국내 집행 가능 ,Social
대법원   삼성증권 유령배당  직원들 유죄 확정,Social
 유령주식  내다판 삼성증권 전 현 직원들  대법서 유죄 확정,Social
코로나 집콕 탓    집에서 쓰는 수돗물만 늘었다,Social
코로나 거리두기에 서울시민 수돗물 사용량      줄어,Social
수락산서 정상 표지석 훔친   대  경찰에 붙잡혔다,Social
 내 힘에 희열 느껴서   불암산 정상석 훔친   대 잡혔다,Social
생활고에 뇌출혈 아버지 방치  간병 살인  청년 징역  년 확정,Social
   으로 사망한 뇌출혈   간병 중 방치    대 아들 징역  년 확정,Social
 검사 출신  곽상도가    억 퇴직금  재판에 대응하는 방법,Social
곽상도  검찰  허위 공문서로 법원 속여   혐의 전면 부인,Social
개통   주년 맞은 KTX   억  천여만 명 이송  국민 한 사람당   회 탑승 ,Social
낭랑   세 된 KTX   주행거리 다 합하면 지구  만     바퀴,Social
BNK부산은행  부산 지역화폐  동백전  서비스 개시,Social
부산은행  지역화폐 동백전 새 사업자로 내달  일 서비스 개시,Social
 뉴스쏙 속 취임식도 하기 전에    향하는 검찰수사,Social
 뉴스쏙 속 임대차  법의 운명은  폐지냐 보완이냐,Social
 뉴스쏙 속 마주앉은      분위기는 좋았다지만 ,Social
 뉴스쏙 속   ICBM이어 핵실험 봉인 푸나  풍계리 복구 중 ,Social
폭스바겐그룹  올해 전기차  종 등 신차   종 출시 전기차 인프라 강화,Culture
폭스바겐그룹코리아 새 출발  올해 신차   종 출시   모빌리티 시너지 극대화 ,Culture
폭스바겐 아우디 포르쉐 람보르기니 벤틀리 똘똘 뭉친다,Culture
폭스바겐그룹코리아  올해  개 브랜드 신차   종 출시 ,Culture
현대차   미술관 전시프로젝트 작가에  세실리아 비쿠냐 ,Culture
현대커미션     년 전시작가  세실리아 비쿠냐  선정,Culture
  테이트미술관서 열리는 현대커미션  올해는 세실리아 바쿠냐,Culture
 현대 커미션      년 전시 작가에 세실리아 비쿠냐,Culture
 기부왕찐천재 홍진경  비영리단체 희망조약돌에 취약계층 위한 기부금  억 후원,Culture
     만원은 좀 그래  내가 보탤게 하더니  억 기부한 홍진경,Culture
 K 콘텐츠 명성 잇는  파친코  글로벌 OTT 경쟁  치열  이슈분석 ,Culture
해외서도 호평 받는  파친코  미 언론  윤여정 추가 수상 논의해야 ,Culture
 전국  mm 안팎 비 내일 아침 대부분 그쳐 날씨 ,Culture
 오후에도 곳곳 비 조금 오후날씨 꿀팁 ,Culture
오늘은 웃음꽃 피는 짜릿한 놀이터,Culture
갯바위 위 사찰 멸치만 명물   판타스틱 테마파크 도 추가 ,Culture
벤츠  지난달 내놓은     만원대   세대 C클래스  국내 인도 시작,Culture
 더 뉴 메르세데스 벤츠 C클래스  국내 고객 인도 시작,Culture
 방호정의 컬쳐 쇼크   조크       세이수미 싱글  Around You ,Culture
 방호정의 컬쳐 쇼크   조크        문화 대통령  서태지,Culture
 방호정의 컬쳐 쇼크   조크       경성대 래퍼 정불타의 새 싱글  조타 ,Culture
 방호정의 컬쳐 쇼크   조크       썸머 오브 소울   혹은 혁명이 방송에 나올 수 없었을 때,Culture
그랜드 캉티뉴쓰 호텔 장르물 전성시대 ,Culture
소행성대를 소재로 한 과학소설들 장르물 전성시대 ,Culture
백광 온갖 진실과 하나의 사실 장르물 전성시대 ,Culture
원수성역 원시사회로 돌아간 인류의 운명은 장르물 전성시대 ,Culture
윌 스미스에게 뺨 맞은 크리스 록  공연 티켓    배  올랐다,World
록산 게이  제이다 스미스는 농담을 웃어 넘길 필요가 없다 ,World
 오스카 폭행  윌 스미스 아내  입 열었다 심경 고백,World
윌 스미스 폭행 후 침묵 깬 제이다 핀켓 스미스  치유의 시기 ,World
 관리  푸틴  러시아군 얼마나 부진한지 잘 모르는 듯 ,World
 푸틴   예스맨 에 현혹돼 오판 내려 대러 제재 파장도 파악 못해 ,World
푸틴의 우크라 침공은 전략적 실수 미 백악관,World
미 정보당국  푸틴 참모들  두려워 진실 말하지 못해 ,World
미 경고 속 만난 중러 외무장관  협력에 상한선 없어 ,World
 인도 방문  배턴터치 하는 왕이 라브로프  중 러 관계 확고 ,World
러시아 중국  우크라 사태로  밀월관계  더 돈독해진다,World
아프간 회의 핑계로 중국 간 러시아 외무,World
바이든  핵 피격시만 핵사용  공약 폐기,World
   북 등 위협에  핵 단일 목적  공약 사실상 폐기,World
BTS 방시혁  타임 표지 모델 하이브  영향력 있는    대 기업 선정,World
방탄소년단  미 타임 또 표지모델로 방시혁도 함께,World
러  철군약속 지역 재폭격  협상 돌파구 없었다 ,World
 영상  러시아군 키이우서 철수  서방  병력 재정비 위한 시간벌기 ,World
 다이하드  브루스 윌리스  실어증으로 은퇴 선언,World
 배우 브루스 윌리스  실어증으로  은퇴  발표,World
식용유 밀가루 진열대  텅텅  전쟁 직격탄 유럽  고물가에  비명 ,World
전쟁 직격탄 맞은 유럽 경제 물가는 치솟고 성장률은 둔화,World
  전략비축유 방출 가능성에 국제 유가 크게 하락,World
   대규모 비축유 방출 검토  보도에 국제유가 하락세,World
미 북한 전문사이트  북한      영웅호 이상 움직임 ,World
   신포 잠수함 특이 동향 SLBM 준비 가능성 ,World
  GDP 목표달성  봉쇄 되나,World
상하이 봉쇄로  성장률     p 하락 전망,World
떠나는 외국인 판사들 흔들리는 홍콩 사법 독립,World
영국  홍콩 대법원서 자국판사  명 철수 홍콩  악의적 행동 ,World
슬픔마저 빼앗긴   여객기 사고 유족들 베이징 노트 ,World
한복  고려인이 입으면 감사 조선족이 입으면 문제  베이징 노트 ,World
 베이징 노트 중국인들의 일상이 된 핵산검사 연휴 이른 시간부터 긴 줄,World
 베이징 노트 한국교민과 조선족 동포가 함께한 베이징 송년회,World
쏘카  지난해 카셰어링 매출     억원     성장,IT
쏘카  코로나 속 매출     성장,IT
 월   만    원 이면 평일에 쏘카 무제한 이용한다,IT
쏘카 작년 매출       데이터 기술 결합해 성장 ,IT
과기정통부  방송 IPTV법 개정안 입법예고  PP 소유제한  폐지,IT
과기정통부  유료방송 규제완화 방송법 IPTV법 개정안 입법예고,IT
IPTV사업자  채널 소유 제한  폐지  방송사업법 개정 추진,IT
IPTV사업자 방송채널 소유제한 폐지 등 방송사업법 개정 추진,IT
 속보 KT 구현모  지주형 회사 전환에 관심 있어 ,IT
KT  지주형 회사 전환 검토   박종욱 KT 각자대표  일신상 이유  자진사퇴,IT
인텔  자체 개발 GPU  아크   월 본격 출시,IT
인텔  데스크톱PC용 아크 그래픽카드 올 여름 출시 ,IT
싸이월드 전용 암호화폐는  개   개    투자자 피해 우려,IT
싸이월드   월  일 오픈 앞두고 홈페이지 리뉴얼 이번엔 진짜 ,IT
애플이  아이폰 구독 에 나서려는 이유  진입장벽 낮춰 추가 성장 겨냥,IT
애플  자체 지불 결제 기술 개발 금융 서비스 독립성 높인다,IT
지난해 하반기 스팸 신고 탐지량 상반기보다 줄었다,IT
 작년 하반기 스팸전화 이메일       감소 ,IT
IBS  극단 및 확률 조합 연구그룹 출범,IT
IBS 극단 및 확률 조합 연구그룹 이끌 CI에 홍 리우 임명,IT
 D데이            전략시뮬레이션 게임 황제  스타크래프트  탄생,IT
 D데이              삼성전자   오스틴 공장 착공,IT
 D데이              카톡왔숑  카카오톡   주년  모바일혁신 중심에 서다,IT
 D데이             월드와이드웹 WWW  탄생 인터넷 대중화 열었다,IT
 게임인사이드 법조계 사외이사 내정  속내는,IT
 게임인사이드  허진영 호 펄어비스  중국 넘고 글로벌 노크 ,IT
 게임인사이드  서머너즈 워  백년전쟁   C X 생태계서 부활할까,IT
 게임인사이드 게임계 중국통    년만 위메이드 복귀한 사연은,IT
